{
  "executive_summary": "Priya's communication in this status update was undermined by excessive hedging, vague estimates, and a lack of structured framing. While she demonstrated honesty about the situation and responsiveness to questions, her updates required significant prompting from Marcus to extract actionable information. The biggest opportunity is learning to lead with the headline — status, risk, ask — before diving into details.",
  "overall_effectiveness_score": 38,
  "communication_status": "needs_improvement",
  "coach_take": "You're doing the hard technical work, but your communication is making you look less competent than you are. Every time you say 'I think' or 'sort of' or 'maybe,' you're handing your credibility to someone else. Marcus had to pull the timeline out of you — that's his job being done for him. You need to walk into these meetings with your numbers ready and your framing tight: here's where we are, here's the risk, here's what I need. That's it. You know your stuff — now let your communication show it.",
  "score_breakdown": {
    "clarity": 35,
    "brevity": 30,
    "structure": 25,
    "audience_alignment": 32,
    "executive_presence": 20,
    "action_orientation": 40,
    "listening_and_responsiveness": 55
  },
  "what_worked": [
    "Honestly acknowledged the project is behind schedule rather than sugarcoating — builds trust even when news is bad",
    "Provided a best-case/worst-case range when pressed, showing ability to think in scenarios",
    "Identified specific blockers (staging environment, auth service incident) rather than vague excuses",
    "Accepted accountability for the client communication gap when Lena raised it"
  ],
  "priority_improvements": [
    {
      "theme": "Lead with the headline, not the journey",
      "diagnosis": "Priya opens with process narration ('we've been making progress, working through scripts') instead of leading with the status and the risk. This forces Marcus to ask multiple follow-up questions to extract the actual situation.",
      "why_it_costs_you": "When your manager has to pull the story out of you, it signals you don't have command of the situation. Leadership loses confidence not in the project, but in you as the person running it.",
      "impact_level": "critical",
      "evidence": [
        {
          "speaker": "Priya Sharma",
          "quote": "Yeah, so, um, we've been making progress. I think we're in a pretty good place, actually. The team has been, you know, working through the schema migration scripts and I think we've gotten through maybe like 60 percent of the tables?",
          "approximate_location": "opening response to status question"
        },
        {
          "speaker": "Marcus Chen",
          "quote": "Okay. When you say 60 percent, is that 60 percent of the tables migrated and tested, or just scripted?",
          "approximate_location": "first follow-up question"
        }
      ],
      "rewrite": {
        "before": "Yeah, so, um, we've been making progress. I think we're in a pretty good place, actually. The team has been, you know, working through the schema migration scripts and I think we've gotten through maybe like 60 percent of the tables?",
        "after": "We're at 60 percent of schema migration scripts complete, zero integration tests run. We're behind plan, and I want to flag two risks: staging has been down, and we lost 10 person-days to the auth incident. I have a path to get back on track — let me walk you through it.",
        "why_better": "Leads with the number, immediately names the gap, quantifies the blockers, and signals you have a plan. Marcus gets the full picture in 10 seconds instead of having to excavate it."
      },
      "drill": "Before your next status meeting, write a 3-line summary: (1) metric/status, (2) biggest risk, (3) what you need. Read it aloud. If it takes more than 15 seconds, cut it down."
    },
    {
      "theme": "Hedging language erodes authority",
      "diagnosis": "Priya habitually qualifies statements with 'I think,' 'maybe,' 'sort of,' 'probably,' and 'I guess.' These hedges are used even when she has the information to make definitive statements, creating an impression of uncertainty that exceeds the actual uncertainty.",
      "why_it_costs_you": "Every hedge word is a small withdrawal from your credibility account. In a room where decisions need to be made, hedging signals you're not sure enough to be trusted with the answer. People start routing around you to get certainty.",
      "impact_level": "high",
      "evidence": [
        {
          "speaker": "Priya Sharma",
          "quote": "I think we might need to push the timeline a little bit? But I'm not sure by how much. Maybe a week? It's hard to tell right now.",
          "approximate_location": "during timeline discussion"
        },
        {
          "speaker": "Priya Sharma",
          "quote": "I guess best case would be... maybe April 4th for all scripts done and basic integration tests passing? Worst case, if the edge cases are really bad, maybe April 18th? But I really don't know.",
          "approximate_location": "response to best-case/worst-case request"
        }
      ],
      "rewrite": {
        "before": "I think we might need to push the timeline a little bit? But I'm not sure by how much. Maybe a week? It's hard to tell right now.",
        "after": "We need to push the timeline. Based on current velocity and the 10 person-days we lost, my best estimate is a one-to-two week slip. I'll have a tighter range by Wednesday once staging is stable and we can assess the edge cases.",
        "why_better": "Drops 'I think' and 'maybe,' replaces vague uncertainty with a bounded range and a date when you'll know more. Shows you've done the math even under uncertainty."
      },
      "drill": "Record yourself in your next meeting. Count every 'I think,' 'sort of,' 'maybe,' and 'probably.' For each one, ask: did I actually need to hedge, or did I know the answer? Target cutting hedge words by 50% in two weeks."
    },
    {
      "theme": "Missing the upstream impact",
      "diagnosis": "Priya had no awareness of the client commitment implications until Lena raised them. As the tech lead on a customer-facing migration, understanding the business impact of timeline changes should be part of her preparation.",
      "why_it_costs_you": "When someone else has to tell you about the impact of your own project's timeline, it signals you're thinking like an individual contributor, not a leader. It makes people wonder what else you haven't considered.",
      "impact_level": "high",
      "evidence": [
        {
          "speaker": "Lena Kowalski",
          "quote": "We have three enterprise clients who were promised the new platform by end of Q1. If we slip to April 18th, that's a month past our external commitment. Have we thought about what we tell those clients?",
          "approximate_location": "mid-meeting, client impact discussion"
        },
        {
          "speaker": "Priya Sharma",
          "quote": "That's a good question. I hadn't really thought about the client communication piece. I've been kind of heads down on the technical work.",
          "approximate_location": "response to Lena's client concern"
        }
      ],
      "rewrite": {
        "before": "That's a good question. I hadn't really thought about the client communication piece. I've been kind of heads down on the technical work.",
        "after": "Good flag, Lena. I should have raised the client impact proactively. I know we have Q1 commitments to three enterprise accounts. Let me sync with you after this meeting to align on what we tell them under each scenario.",
        "why_better": "Acknowledges the gap without making an excuse, shows you actually know the client context, and immediately proposes a next step. Turns a moment of weakness into a display of ownership."
      },
      "drill": "Before every status meeting, spend 5 minutes listing the top 3 stakeholders outside your team who are affected by your project's status. For each, write one sentence on what they care about. Bring that context into your update."
    },
    {
      "theme": "Unnecessary apology undermines closing",
      "diagnosis": "Priya closes with an apology and a defense of the team's effort. While the intent is good, ending on an apology reframes the entire meeting around failure rather than forward momentum.",
      "why_it_costs_you": "The last thing you say in a meeting is what people remember. Closing with 'I'm sorry' and 'the team is working really hard' makes the takeaway about problems rather than the plan you just built to solve them.",
      "impact_level": "medium",
      "evidence": [
        {
          "speaker": "Priya Sharma",
          "quote": "I think we're good. I just want to say, I know this is behind where we wanted to be, and I'm sorry about that. The team is working really hard.",
          "approximate_location": "closing remarks"
        }
      ],
      "rewrite": {
        "before": "I think we're good. I just want to say, I know this is behind where we wanted to be, and I'm sorry about that. The team is working really hard.",
        "after": "We're clear on next steps. I'll have the revised timeline to you by Wednesday, and I'll flag any edge-case surprises as soon as we find them. We'll get this to a confident go/no-go for the 28th.",
        "why_better": "Ends on forward momentum and a commitment. Shows you're focused on the solution, not dwelling on the problem. Much stronger final impression."
      },
      "drill": "For the next two weeks, script your meeting closing before the meeting starts. Write one sentence that summarizes what you're going to deliver and by when. Deliver it as your last statement."
    }
  ],
  "missed_opportunities": [
    {
      "moment": "Opening response when Marcus asked for the data layer status",